{"$schema":"https:\/\/json-schema.org\/draft\/2020-12\/schema","$id":"https:\/\/remsoft.tools\/schemas\/project-flow\/requirement-state-v4.json","title":"Project Flow sourced Feature or Bug state","type":"object","additionalProperties":false,"required":["schema_version","run_id","internal_identity","mode","item_type","phase","completed_phases","identity","redmine","sources","repository","decisions","approvals","deferred_questions","pauses","lock","remote_operations"],"properties":{"schema_version":{"enum":[2,3,4]},"run_id":{"type":"string","format":"uuid"},"internal_identity":{"type":"string","format":"uuid"},"mode":{"enum":["new-issue","new-scope"]},"item_type":{"enum":["Feature","Bug"]},"phase":{"enum":["mode-confirmed","inputs-normalized","repository-analyzed","item-ready","item-created","interviewing","requirement-proposed","requirement-approved","redmine-synchronized","completed","paused"]},"completed_phases":{"type":"array","uniqueItems":true,"items":{"enum":["mode-confirmed","inputs-normalized","repository-analyzed","item-ready","item-created","interviewing","requirement-proposed","requirement-approved","redmine-synchronized","completed"]}},"identity":{"type":"object","additionalProperties":false,"required":["redmine_user_id","display_name","confirmed_at"],"properties":{"redmine_user_id":{"type":["integer","string"]},"display_name":{"type":"string","minLength":1},"confirmed_at":{"type":"string","format":"date-time"}}},"classification":{"type":"object","additionalProperties":false,"required":["suggested_type","rationale","confirmed_type","confirmed_by","confirmed_at"],"properties":{"suggested_type":{"enum":["Feature","Bug"]},"rationale":{"type":"string","minLength":1},"confirmed_type":{"enum":["Feature","Bug"]},"confirmed_by":{"type":"string","minLength":1},"confirmed_at":{"type":"string","format":"date-time"}}},"similarity":{"type":"object","additionalProperties":false,"required":["searched_at","candidates","decision","confirmed_by","confirmed_at"],"properties":{"searched_at":{"type":"string","format":"date-time"},"candidates":{"type":"array","items":{"type":"object","additionalProperties":false,"required":["issue_id","title","status","reason"],"properties":{"issue_id":{"type":["integer","string"]},"title":{"type":"string","minLength":1},"status":{"type":"string","minLength":1},"reason":{"type":"string","minLength":1}}}},"decision":{"enum":["new-demand","existing-demand"]},"existing_issue_id":{"type":["integer","string"]},"confirmed_by":{"type":"string","minLength":1},"confirmed_at":{"type":"string","format":"date-time"}}},"redmine":{"type":"object","additionalProperties":false,"required":["project_id","project_name","tracker_id","tracker_name","initial_status_id","initial_status_name","mapping_confirmations"],"properties":{"project_id":{"type":["integer","string"]},"project_name":{"type":"string","minLength":1},"tracker_id":{"type":["integer","string"]},"tracker_name":{"type":"string","minLength":1},"initial_status_id":{"type":["integer","string"]},"initial_status_name":{"type":"string","minLength":1},"approved_status_id":{"type":["integer","string","null"]},"approved_status_name":{"type":["string","null"]},"mapping_confirmations":{"type":"array","items":{"$ref":"#\/$defs\/mapping_confirmation"}},"category":{"anyOf":[{"$ref":"#\/$defs\/category"},{"type":"null"}]},"issue_id":{"type":["integer","null"]}}},"sources":{"type":"array","minItems":1,"items":{"$ref":"#\/$defs\/source"}},"repository":{"type":"object","additionalProperties":false,"required":["stack","vocabulary","exclusions"],"properties":{"stack":{"type":"array","items":{"type":"string"}},"vocabulary":{"type":"array","items":{"type":"object","additionalProperties":false,"required":["term","evidence_paths"],"properties":{"term":{"type":"string","minLength":1},"evidence_paths":{"type":"array","minItems":1,"items":{"type":"string","minLength":1}}}}},"exclusions":{"type":"array","items":{"type":"string"}}}},"decisions":{"type":"array","items":{"$ref":"#\/$defs\/decision"}},"approvals":{"type":"array","items":{"$ref":"#\/$defs\/approval"}},"deferred_questions":{"type":"array","items":{"$ref":"#\/$defs\/deferred_question"}},"pauses":{"type":"array","items":{"$ref":"#\/$defs\/pause"}},"lock":{"$ref":"#\/$defs\/lock"},"remote_operations":{"type":"object","additionalProperties":false,"required":["create","publish"],"properties":{"create":{"$ref":"#\/$defs\/operation"},"publish":{"$ref":"#\/$defs\/operation"},"relations":{"type":"array","items":{"$ref":"#\/$defs\/relation_operation"}}}},"remote_observations":{"type":"array","items":{"$ref":"#\/$defs\/remote_observation"}},"requirement_divergences":{"type":"array","items":{"$ref":"#\/$defs\/requirement_divergence"}},"title_convention":{"anyOf":[{"$ref":"catalog.schema.json#\/$defs\/title_convention"},{"type":"null"}]},"delivery":{"anyOf":[{"$ref":"catalog.schema.json#\/$defs\/delivery"},{"type":"null"}]},"scope_item":{"anyOf":[{"type":"object","additionalProperties":false,"required":["state_path","catalog_item_id","catalog_sha256"],"properties":{"state_path":{"type":"string","minLength":1},"catalog_item_id":{"type":"string","minLength":1},"catalog_sha256":{"type":"string","pattern":"^[a-f0-9]{64}$"}}},{"type":"null"}]}},"allOf":[{"if":{"anyOf":[{"properties":{"phase":{"const":"item-ready"}},"required":["phase"]},{"properties":{"completed_phases":{"contains":{"const":"item-ready"}}},"required":["completed_phases"]}]},"then":{"required":["classification","similarity"]}},{"if":{"properties":{"completed_phases":{"contains":{"const":"item-ready"}}},"required":["completed_phases"]},"then":{"properties":{"redmine":{"required":["category"],"properties":{"category":{"type":"object"}}}}}},{"if":{"properties":{"completed_phases":{"contains":{"const":"item-created"}}},"required":["completed_phases"]},"then":{"properties":{"redmine":{"required":["issue_id"]}}}},{"if":{"properties":{"schema_version":{"enum":[3,4]}}},"then":{"required":["remote_observations","requirement_divergences"],"properties":{"remote_operations":{"required":["relations"]}}}},{"if":{"properties":{"schema_version":{"const":4}}},"then":{"required":["title_convention","delivery","scope_item"]},"else":{"properties":{"title_convention":false,"delivery":false,"scope_item":false}}},{"if":{"allOf":[{"properties":{"schema_version":{"const":4}}},{"anyOf":[{"properties":{"phase":{"const":"item-ready"}}},{"properties":{"completed_phases":{"contains":{"const":"item-ready"}}}}]}]},"then":{"properties":{"title_convention":{"type":"object"},"delivery":{"type":"object"}}}}],"$defs":{"source":{"type":"object","additionalProperties":false,"required":["id","name","type","origin","status","decision_reconciliation"],"properties":{"id":{"type":"string","pattern":"^[a-z0-9][a-z0-9-]*$"},"name":{"type":"string","minLength":1},"type":{"type":"string","minLength":1},"origin":{"type":"string","minLength":1},"status":{"enum":["normalized","unreadable","removed"]},"path":{"type":"string","pattern":"^(sources\/[a-zA-Z0-9._-]+|\\.\\.\/\\.\\.\/scopes\/[a-zA-Z0-9._-]+\/sources\/[a-zA-Z0-9._-]+)\\.md$"},"original_sha256":{"type":["string","null"],"pattern":"^[a-f0-9]{64}$"},"hash_unavailable_reason":{"type":["string","null"],"minLength":1},"normalized_sha256":{"type":"string","pattern":"^[a-f0-9]{64}$"},"extraction_method":{"type":"string","minLength":1},"fully_read":{"type":"boolean"},"diagnostic":{"type":"string","minLength":1},"removed_by":{"type":"string","minLength":1},"removed_at":{"type":"string","format":"date-time"},"removal_reason":{"type":"string","minLength":1},"decision_reconciliation":{"enum":["not-applicable","pending","completed"]}},"allOf":[{"if":{"properties":{"status":{"const":"normalized"}}},"then":{"required":["path","original_sha256","hash_unavailable_reason","normalized_sha256","extraction_method","fully_read"],"properties":{"fully_read":{"const":true}}}},{"if":{"properties":{"status":{"const":"normalized"},"original_sha256":{"type":"null"}},"required":["original_sha256"]},"then":{"properties":{"hash_unavailable_reason":{"type":"string","minLength":1}}},"else":{"properties":{"hash_unavailable_reason":{"type":"null"}}}},{"if":{"properties":{"status":{"const":"unreadable"}}},"then":{"required":["diagnostic"],"properties":{"decision_reconciliation":{"const":"pending"}}}},{"if":{"properties":{"status":{"const":"removed"}}},"then":{"required":["removed_by","removed_at","removal_reason"],"properties":{"decision_reconciliation":{"enum":["not-applicable","completed"]}}}}]},"mapping_confirmation":{"type":"object","additionalProperties":false,"required":["kind","selected_id","selected_name","confirmed_by","confirmed_at"],"properties":{"kind":{"enum":["tracker","initial-status","approved-status"]},"selected_id":{"type":["integer","string"]},"selected_name":{"type":"string","minLength":1},"confirmed_by":{"type":"string","minLength":1},"confirmed_at":{"type":"string","format":"date-time"}}},"category":{"type":"object","additionalProperties":false,"required":["id","name","confirmed_by","confirmed_at"],"properties":{"id":{"type":["integer","string","null"]},"name":{"type":["string","null"]},"confirmed_by":{"type":"string","minLength":1},"confirmed_at":{"type":"string","format":"date-time"}}},"decision":{"type":"object","additionalProperties":false,"required":["id","statement","decided_by","decided_at","status"],"properties":{"id":{"type":"string","minLength":1},"statement":{"type":"string","minLength":1},"decided_by":{"type":"string","minLength":1},"decided_at":{"type":"string","format":"date-time"},"status":{"enum":["valid","reopened"]},"reopened_at":{"type":"string","format":"date-time"},"reopened_reason":{"type":"string","minLength":1}}},"approval":{"type":"object","additionalProperties":false,"required":["id","kind","subject_sha256","approved_by","approved_at","status"],"properties":{"id":{"type":"string","minLength":1},"kind":{"enum":["create-payload","requirement","publish-payload","relation-payload","abandonment-payload"]},"subject_sha256":{"type":"string","pattern":"^[a-f0-9]{64}$"},"approved_by":{"type":"string","minLength":1},"approved_at":{"type":"string","format":"date-time"},"status":{"enum":["valid","invalidated"]},"invalidated_at":{"type":"string","format":"date-time"},"invalidated_reason":{"type":"string","minLength":1}}},"resolution":{"type":"object","additionalProperties":false,"required":["answer","source","resolved_at"],"properties":{"answer":{"type":"string","minLength":1},"source":{"type":"string","minLength":1},"resolved_at":{"type":"string","format":"date-time"}}},"deferred_question":{"type":"object","additionalProperties":false,"required":["id","question","responsible_role","reason","blocked_decisions","status","asked_at"],"properties":{"id":{"type":"string","minLength":1},"question":{"type":"string","minLength":1},"responsible_role":{"type":"string","minLength":1},"reason":{"type":"string","minLength":1},"blocked_decisions":{"type":"array","minItems":1,"uniqueItems":true,"items":{"type":"string","minLength":1}},"status":{"enum":["pending","resolved"]},"asked_at":{"type":"string","format":"date-time"},"resolution":{"$ref":"#\/$defs\/resolution"}}},"pause":{"type":"object","additionalProperties":false,"required":["id","status","kind","previous_phase","resume_phase","reason","resume_condition","paused_at"],"properties":{"id":{"type":"string","minLength":1},"status":{"enum":["paused","resumed"]},"kind":{"enum":["decision-deferred","third-party-question","voluntary-stop"]},"previous_phase":{"enum":["mode-confirmed","inputs-normalized","repository-analyzed","item-ready","item-created","interviewing","requirement-proposed","requirement-approved","redmine-synchronized","completed"]},"resume_phase":{"enum":["mode-confirmed","inputs-normalized","repository-analyzed","item-ready","item-created","interviewing","requirement-proposed","requirement-approved","redmine-synchronized","completed"]},"reason":{"type":"string","minLength":1},"resume_condition":{"type":"string","minLength":1},"paused_at":{"type":"string","format":"date-time"},"resumed_at":{"type":"string","format":"date-time"},"resume_evidence":{"type":"string","minLength":1}}},"lock":{"type":"object","additionalProperties":false,"required":["item_key","lock_id","path","acquired_at"],"properties":{"item_key":{"type":"string","minLength":1},"lock_id":{"type":"string","format":"uuid"},"path":{"type":"string","pattern":"^docs\/harness\/\\.locks\/[a-f0-9]{64}\\.lock\\.json$"},"acquired_at":{"type":"string","format":"date-time"},"recovered_from":{"type":"string","format":"uuid"},"recovery_reason":{"type":"string","minLength":1}}},"operation":{"type":"object","additionalProperties":false,"required":["status"],"properties":{"status":{"enum":["pending","approved","completed","unknown"]},"payload_sha256":{"type":"string","pattern":"^[a-f0-9]{64}$"},"approved_by":{"type":"string","minLength":1},"approved_at":{"type":"string","format":"date-time"},"completed_at":{"type":"string","format":"date-time"},"observation_id":{"type":"string","minLength":1},"attempts":{"type":"array","items":{"$ref":"#\/$defs\/attempt"}}}},"attempt":{"type":"object","additionalProperties":false,"required":["id","attempted_at","outcome"],"properties":{"id":{"type":"string","minLength":1},"attempted_at":{"type":"string","format":"date-time"},"outcome":{"enum":["completed","failed","unknown"]},"error_code":{"type":"string","pattern":"^[a-z0-9._-]+$"},"sanitized_message":{"type":"string","minLength":1}}},"relation_operation":{"type":"object","additionalProperties":false,"required":["key","relation_type","source_issue_id","target_issue_id","status"],"properties":{"key":{"type":"string","minLength":1},"relation_type":{"type":"string","minLength":1},"source_issue_id":{"type":["integer","string"]},"target_issue_id":{"type":["integer","string"]},"status":{"enum":["pending","approved","completed","unknown"]},"payload_sha256":{"type":"string","pattern":"^[a-f0-9]{64}$"},"approved_by":{"type":"string","minLength":1},"approved_at":{"type":"string","format":"date-time"},"completed_at":{"type":"string","format":"date-time"},"observation_id":{"type":"string","minLength":1},"attempts":{"type":"array","items":{"$ref":"#\/$defs\/attempt"}}}},"remote_observation":{"type":"object","additionalProperties":false,"required":["id","operation_key","observed_at","outcome","summary"],"properties":{"id":{"type":"string","minLength":1},"operation_key":{"type":"string","minLength":1},"observed_at":{"type":"string","format":"date-time"},"outcome":{"enum":["matched","absent","diverged","ambiguous"]},"remote_sha256":{"type":"string","pattern":"^[a-f0-9]{64}$"},"summary":{"type":"string","minLength":1}}},"requirement_divergence":{"type":"object","additionalProperties":false,"required":["id","observed_at","remote_sha256","summary","status"],"properties":{"id":{"type":"string","minLength":1},"observed_at":{"type":"string","format":"date-time"},"remote_sha256":{"type":"string","pattern":"^[a-f0-9]{64}$"},"summary":{"type":"string","minLength":1},"status":{"enum":["pending","accepted","rejected"]},"decided_by":{"type":"string","minLength":1},"decided_at":{"type":"string","format":"date-time"},"decision_reason":{"type":"string","minLength":1}}}}}