{
  "schema_version": 4,
  "run_id": "45ff72fa-aa3c-402e-9075-16cc3928c876",
  "internal_identity": "3f29152b-1524-4b5e-ae4f-b1af10bd55c5",
  "mode": "new-scope",
  "item_type": "Feature",
  "phase": "completed",
  "completed_phases": [
    "mode-confirmed",
    "inputs-normalized",
    "repository-analyzed",
    "item-ready",
    "item-created",
    "interviewing",
    "requirement-proposed",
    "requirement-approved",
    "redmine-synchronized",
    "completed"
  ],
  "identity": {
    "redmine_user_id": 131789,
    "display_name": "Mário Tinelli",
    "confirmed_at": "2026-09-09T19:14:01.0762355Z"
  },
  "redmine": {
    "project_id": 65221,
    "project_name": "Nexum",
    "tracker_id": 2,
    "tracker_name": "Feature",
    "initial_status_id": 1,
    "initial_status_name": "New",
    "approved_status_id": 4,
    "approved_status_name": "Approved",
    "mapping_confirmations": [],
    "category": {
      "id": null,
      "name": null,
      "confirmed_by": "Mário Tinelli",
      "confirmed_at": "2026-09-10T11:03:04.045559Z"
    },
    "issue_id": 1014448
  },
  "sources": [
    {
      "id": "design-profile",
      "name": "perfil.html",
      "type": "design HTML da tela Perfil",
      "origin": "C:\\Users\\maari\\Downloads\\nexum-scope\\design\\perfil.html",
      "status": "normalized",
      "path": "../../scopes/2026-09-09-nexum-scope/sources/design-profile.md",
      "original_sha256": "5ad97f0615799cbe9b6c4d601a508b80645bb177c6e15a63ad194e7cd068b19e",
      "hash_unavailable_reason": null,
      "normalized_sha256": "4a3d82c0c273424ae39e6647b54d3b4d994a829d74074b019c0946c30d3ffbfa",
      "extraction_method": "análise estática integral de HTML/CSS/JavaScript UTF-8, sem executar conteúdo ativo",
      "fully_read": true,
      "decision_reconciliation": "not-applicable"
    },
    {
      "id": "design-guide",
      "name": "guia-de-design.html",
      "type": "design HTML e anotações de produto",
      "origin": "C:\\Users\\maari\\Downloads\\nexum-scope\\design\\guia-de-design.html",
      "status": "normalized",
      "path": "../../scopes/2026-09-09-nexum-scope/sources/design-guide.md",
      "original_sha256": "801383f4687ff5c25486f5007341cf625910d75f7c6c9337d552ce3ec29baceb",
      "hash_unavailable_reason": null,
      "normalized_sha256": "14cd798e9f9cec0b74b5c6f4c53ff8f8a9a9cfe3ab57a16ba0a6df47b0fa696a",
      "extraction_method": "leitura estática integral do HTML UTF-8; texto extraído e scripts preservados como evidência inerte, sem execução.",
      "fully_read": true,
      "decision_reconciliation": "completed"
    }
  ],
  "repository": {
    "stack": [
      "PHP 8.4",
      "Laravel 13",
      "Livewire 4",
      "Tailwind CSS 4, DaisyUI 5 e Alpine.js 3",
      "MySQL e Eloquent",
      "Pest 5 e PHPUnit 12",
      "r2luna/brain 4.1",
      "Laravel Auditing 14"
    ],
    "vocabulary": [
      {
        "term": "Usuário",
        "evidence_paths": [
          "app/Models/User.php",
          "docs/agents/domain_rules.md",
          "sources/design-users.md"
        ]
      },
      {
        "term": "Administrador",
        "evidence_paths": [
          "app/Enums/TypeUsers.php",
          "sources/design-users.md"
        ]
      },
      {
        "term": "Gestor",
        "evidence_paths": [
          "sources/design-new-project.md",
          "sources/design-edit-project.md",
          "sources/design-new-task.md"
        ]
      },
      {
        "term": "Membro",
        "evidence_paths": [
          "sources/design-projects.md",
          "sources/design-dashboard.md",
          "sources/design-new-task.md"
        ]
      },
      {
        "term": "Projeto",
        "evidence_paths": [
          "sources/design-projects.md",
          "sources/design-new-project.md",
          "sources/design-edit-project.md"
        ]
      },
      {
        "term": "Tarefa",
        "evidence_paths": [
          "sources/design-tasks.md",
          "sources/design-new-task.md",
          "sources/design-edit-task.md"
        ]
      },
      {
        "term": "Situação da tarefa",
        "evidence_paths": [
          "sources/design-board.md",
          "sources/design-new-task.md",
          "sources/design-edit-task.md"
        ]
      },
      {
        "term": "Prioridade da tarefa",
        "evidence_paths": [
          "sources/design-new-task.md",
          "sources/design-tasks.md"
        ]
      },
      {
        "term": "Projeto arquivado",
        "evidence_paths": [
          "sources/design-edit-project.md",
          "sources/design-board.md",
          "sources/design-projects.md"
        ]
      }
    ],
    "exclusions": [
      "vendor/** e node_modules/**",
      ".git/**",
      "storage/logs/**, caches e arquivos temporários",
      "public/build/**, artefatos Vite e relatórios de cobertura",
      ".env*, credenciais, chaves privadas e tokens",
      "binários e conteúdo gerado sem relevância funcional"
    ]
  },
  "classification": {
    "suggested_type": "Feature",
    "rationale": "Autogestão de dados pessoais e senha aprovada como Feature no catálogo.",
    "confirmed_type": "Feature",
    "confirmed_by": "Mário Tinelli",
    "confirmed_at": "2026-09-10T11:03:04.045559Z"
  },
  "similarity": {
    "searched_at": "2026-09-10T11:03:04.045559Z",
    "candidates": [],
    "decision": "new-demand",
    "confirmed_by": "Mário Tinelli",
    "confirmed_at": "2026-09-10T11:03:04.045559Z"
  },
  "decisions": [
    {
      "id": "creation-confirmation",
      "statement": "Mário Tinelli respondeu aprovo à prévia completa de Meu Perfil, nova Feature sem categoria. Busca no projeto encontrou somente Autenticação e Recuperação de Senha, que excluem esta capacidade.",
      "decided_by": "Mário Tinelli",
      "decided_at": "2026-09-10T11:03:04.045559Z",
      "status": "valid"
    },
    {
      "id": "q11",
      "statement": "Novo e-mail válido e não utilizado passa a valer imediatamente para login e recuperação, sem confirmação por e-mail.",
      "decided_by": "Mário Tinelli",
      "decided_at": "2026-09-10T11:09:58.572552Z",
      "status": "valid"
    },
    {
      "id": "q12",
      "statement": "Dados pessoais e troca de senha ficam em cards separados, cada um com seu componente e botão. As ações são independentes; a proposta de salvamento conjunto foi rejeitada.",
      "decided_by": "Mário Tinelli",
      "decided_at": "2026-09-10T11:09:58.572552Z",
      "status": "valid"
    },
    {
      "id": "q13",
      "statement": "Aplicar a mesma política de Recuperação de Senha: mínimo de 8 caracteres, maiúscula, minúscula, número, símbolo, rejeição de senhas conhecidas em vazamentos e confirmação idêntica.",
      "decided_by": "Mário Tinelli",
      "decided_at": "2026-09-10T11:09:58.572552Z",
      "status": "valid"
    },
    {
      "id": "q14",
      "statement": "Após trocar a senha, manter a sessão atual, encerrar as demais e remover Lembrar-me de todos os dispositivos.",
      "decided_by": "Mário Tinelli",
      "decided_at": "2026-09-10T11:09:58.572552Z",
      "status": "valid"
    },
    {
      "id": "understanding-confirmation-001",
      "statement": "Mário Tinelli confirmou com Sim o entendimento após Q11–Q14, incluindo os dois cards, componentes e botões independentes. Entrevista concluída sem gaps ou contradições.",
      "decided_by": "Mário Tinelli",
      "decided_at": "2026-09-10T11:11:57.362027Z",
      "status": "valid"
    },
    {
      "id": "explicit-cards-in-flows",
      "statement": "Usuário solicitou explicitar Card Dados Pessoais e Card Troca de Senha nos fluxos e aprovou o restante. Texto ajustado conforme prévia apresentada, preservando comportamento e status New.",
      "decided_by": "Mário Tinelli",
      "decided_at": "2026-09-10T11:20:28.089283Z",
      "status": "valid"
    },
    {
      "id": "catalog-time-reconciliation-001",
      "statement": "Metadados reconciliados com catalog-time-review-001 aprovado por Mário Tinelli. Conteúdo canônico byte a byte preservado. Aprovação requirement-profile-002 revalidada para o mesmo hash, com autor e data originais; não representa nova aprovação ou publicação.",
      "decided_by": "Mário Tinelli",
      "decided_at": "2026-09-10T18:57:55.794421Z",
      "status": "valid"
    }
  ],
  "approvals": [
    {
      "id": "create-profile-001",
      "kind": "create-payload",
      "subject_sha256": "521097b23c563fc8ee2cc1f9f820c48203cbb2e75d8c20dcd77a0ffd5e87101b",
      "approved_by": "Mário Tinelli",
      "approved_at": "2026-09-10T11:03:04.045559Z",
      "status": "invalidated",
      "invalidated_at": "2026-09-10T18:57:55.794421Z",
      "invalidated_reason": "Reconciliação com catalog-time-review-001. Operações remotas anteriores permanecem concluídas; conteúdo preservado mantém a proveniência da aprovação original."
    },
    {
      "id": "relation-authenticate-profile-001",
      "kind": "relation-payload",
      "subject_sha256": "e1a160fed97ecc765fe064a2b06870397e971164824d889f555d2583fb5559d6",
      "approved_by": "Mário Tinelli",
      "approved_at": "2026-09-10T11:05:58.152011Z",
      "status": "invalidated",
      "invalidated_at": "2026-09-10T18:57:55.794421Z",
      "invalidated_reason": "Reconciliação com catalog-time-review-001. Operações remotas anteriores permanecem concluídas; conteúdo preservado mantém a proveniência da aprovação original."
    },
    {
      "id": "requirement-profile-001",
      "kind": "requirement",
      "subject_sha256": "63e7c8946c45642ee3c928504dfd6dd8a748eac3953e597cda637616ccd28022",
      "approved_by": "Mário Tinelli",
      "approved_at": "2026-09-10T11:16:01.615708Z",
      "status": "invalidated",
      "invalidated_at": "2026-09-10T11:20:28.089283Z",
      "invalidated_reason": "Ajuste editorial solicitado: identificar explicitamente os dois cards nos fluxos; restante aprovado."
    },
    {
      "id": "requirement-profile-002",
      "kind": "requirement",